[I 2024-12-11 23:47:36,226] Trial 49 pruned. 
Expected parameter loc (Tensor of shape (256, 1)) of distribution Normal(loc: torch.Size([256, 1]), scale: torch.Size([256, 1])) to satisfy the constraint Real(), but found invalid values:
tensor([[nan],
        [nan],
        [nan],
        [nan],
        [nan],
        [nan],
        [nan],
        [nan],
        [nan],
        [nan],
        [nan],
        [nan],
        [nan],
        [nan],
        [nan],
        [nan],
        [nan],
        [nan],
        [nan],
        [nan],
        [nan],
        [nan],
        [nan],
        [nan],
        [nan],
        [nan],
        [nan],
        [nan],
        [nan],
        [nan],
        [nan],
        [nan],
        [nan],
        [nan],
        [nan],
        [nan],
        [nan],
        [nan],
        [nan],
        [nan],
        [nan],
        [nan],
        [nan],
        [nan],
        [nan],
        [nan],
        [nan],
        [nan],
        [nan],
        [nan],
        [nan],
        [nan],
        [nan],
        [nan],
        [nan],
        [nan],
        [nan],
        [nan],
        [nan],
        [nan],
        [nan],
        [nan],
        [nan],
        [nan],
        [nan],
        [nan],
        [nan],
        [nan],
        [nan],
        [nan],
        [nan],
        [nan],
        [nan],
        [nan],
        [nan],
        [nan],
        [nan],
        [nan],
        [nan],
        [nan],
        [nan],
        [nan],
        [nan],
        [nan],
        [nan],
        [nan],
        [nan],
        [nan],
        [nan],
        [nan],
        [nan],
        [nan],
        [nan],
        [nan],
        [nan],
        [nan],
        [nan],
        [nan],
        [nan],
        [nan],
        [nan],
        [nan],
        [nan],
        [nan],
        [nan],
        [nan],
        [nan],
        [nan],
        [nan],
        [nan],
        [nan],
        [nan],
        [nan],
        [nan],
        [nan],
        [nan],
        [nan],
        [nan],
        [nan],
        [nan],
        [nan],
        [nan],
        [nan],
        [nan],
        [nan],
        [nan],
        [nan],
        [nan],
        [nan],
        [nan],
        [nan],
        [nan],
        [nan],
        [nan],
        [nan],
        [nan],
        [nan],
        [nan],
        [nan],
        [nan],
        [nan],
        [nan],
        [nan],
        [nan],
        [nan],
        [nan],
        [nan],
        [nan],
        [nan],
        [nan],
        [nan],
        [nan],
        [nan],
        [nan],
        [nan],
        [nan],
        [nan],
        [nan],
        [nan],
        [nan],
        [nan],
        [nan],
        [nan],
        [nan],
        [nan],
        [nan],
        [nan],
        [nan],
        [nan],
        [nan],
        [nan],
        [nan],
        [nan],
        [nan],
        [nan],
        [nan],
        [nan],
        [nan],
        [nan],
        [nan],
        [nan],
        [nan],
        [nan],
        [nan],
        [nan],
        [nan],
        [nan],
        [nan],
        [nan],
        [nan],
        [nan],
        [nan],
        [nan],
        [nan],
        [nan],
        [nan],
        [nan],
        [nan],
        [nan],
        [nan],
        [nan],
        [nan],
        [nan],
        [nan],
        [nan],
        [nan],
        [nan],
        [nan],
        [nan],
        [nan],
        [nan],
        [nan],
        [nan],
        [nan],
        [nan],
        [nan],
        [nan],
        [nan],
        [nan],
        [nan],
        [nan],
        [nan],
        [nan],
        [nan],
        [nan],
        [nan],
        [nan],
        [nan],
        [nan],
        [nan],
        [nan],
        [nan],
        [nan],
        [nan],
        [nan],
        [nan],
        [nan],
        [nan],
        [nan],
        [nan],
        [nan],
        [nan],
        [nan],
        [nan],
        [nan],
        [nan],
        [nan],
        [nan],
        [nan],
        [nan],
        [nan],
        [nan],
        [nan],
        [nan],
        [nan],
        [nan]], grad_fn=<AddmmBackward0>)
============
Sampled hyperparams:
{'batch_size': 256,
 'buffer_size': 100000,
 'ent_coef': 'auto',
 'gamma': 0.98,
 'gradient_steps': 128,
 'learning_rate': 0.31801947369513206,
 'learning_starts': 1000,
 'policy_kwargs': {'log_std_init': -3.058312172653075,
                   'net_arch': [256, 256],
                   'use_sde': False},
 'target_entropy': 'auto',
 'tau': 0.05,
 'train_freq': 128}
Expected parameter loc (Tensor of shape (1024, 1)) of distribution Normal(loc: torch.Size([1024, 1]), scale: torch.Size([1024, 1])) to satisfy the constraint Real(), but found invalid values:
tensor([[nan],
        [nan],
        [nan],
        ...,
        [nan],
        [nan],
        [nan]], grad_fn=<AddmmBackward0>)
============
Sampled hyperparams:
{'batch_size': 1024,
 'buffer_size': 100000,
 'ent_coef': 'auto',
 'gamma': 0.98,
 'gradient_steps': 256,
 'learning_rate': 0.3758005869181941,
 'learning_starts': 1000,
 'policy_kwargs': {'log_std_init': -0.7424623228857373,
                   'net_arch': [400, 300],
                   'use_sde': False},
 'target_entropy': 'auto',
 'tau': 0.08,
 'train_freq': 256}
Number of finished trials:  50
Best trial:
Value:  -194.78790120000002
Params: 
    gamma: 0.98
    learning_rate: 0.0076741155152266665
    batch_size: 2048
    buffer_size: 100000
    learning_starts: 1000
    train_freq: 256
    tau: 0.005
    log_std_init: 0.20204202497002022
    net_arch: big
Writing report to sac/sac/report_Pendulum-v1_50-trials-25000-tpe-median_1733960856
