[I 2024-12-11 04:00:39,928] Trial 49 pruned. 
========== Pendulum-v1 ==========
Seed: 3730940181
Loading hyperparameters from: /root/github/advanced_ml/Exercise2/rl-baselines3-zoo/hyperparams/td3.yml
Default hyperparameters for environment (ones being tuned will be overridden):
OrderedDict([('buffer_size', 200000),
             ('gamma', 0.98),
             ('gradient_steps', 1),
             ('learning_rate', 0.001),
             ('learning_starts', 10000),
             ('n_timesteps', 20000),
             ('noise_std', 0.1),
             ('noise_type', 'normal'),
             ('policy', 'MlpPolicy'),
             ('policy_kwargs', 'dict(net_arch=[400, 300])'),
             ('train_freq', 1)])
Using 1 environments
Overwriting n_timesteps with n=25000
Doing 1 intermediate evaluations for pruning based on the number of timesteps. (1 evaluation every 100k timesteps)
Applying normal noise with std 0.1
Optimizing hyperparameters
Sampler: tpe - Pruner: median
Number of finished trials:  50
Best trial:
Value:  -167.12878960000003
Params: 
    gamma: 0.98
    learning_rate: 0.0011129017239161613
    batch_size: 64
    buffer_size: 1000000
    tau: 0.08
    train_freq: 256
    noise_type: ornstein-uhlenbeck
    noise_std: 0.05653466866216936
    net_arch: small
Writing report to td3/td3/report_Pendulum-v1_50-trials-25000-tpe-median_1733889639
/root/github/advanced_ml/Exercise2/venv/lib/python3.12/site-packages/optuna/_experimental.py:31: ExperimentalWarning: Argument ``multivariate`` is an experimental feature. The interface can change in the future.
  warnings.warn(
[I 2024-12-11 04:00:42,985] A new study created in memory with name: no-name-32effac5-d7a7-4527-b2c9-53f83b3a63f3
[I 2024-12-11 04:00:45,003] Trial 0 pruned. 
[I 2024-12-11 04:03:50,087] Trial 1 finished with value: -1170.9680084 and parameters: {'gamma': 0.98, 'learning_rate': 3.0979580160525174e-05, 'batch_size': 16, 'buffer_size': 10000, 'learning_starts': 10000, 'train_freq': 4, 'tau': 0.005, 'log_std_init': -2.445070104266855, 'net_arch': 'medium'}. Best is trial 1 with value: -1170.9680084.
[I 2024-12-11 05:26:31,302] Trial 2 finished with value: -199.82772519999997 and parameters: {'gamma': 0.98, 'learning_rate': 0.01514067896266551, 'batch_size': 2048, 'buffer_size': 100000, 'learning_starts': 1000, 'train_freq': 512, 'tau': 0.05, 'log_std_init': -0.9275632127605147, 'net_arch': 'big'}. Best is trial 2 with value: -199.82772519999997.
[I 2024-12-11 05:26:32,989] Trial 3 pruned. 
[I 2024-12-11 05:53:34,742] Trial 4 finished with value: -206.14288900000003 and parameters: {'gamma': 0.98, 'learning_rate': 0.0007588595577385696, 'batch_size': 1024, 'buffer_size': 1000000, 'learning_starts': 1000, 'train_freq': 512, 'tau': 0.08, 'log_std_init': -3.4733771796285966, 'net_arch': 'medium'}. Best is trial 2 with value: -199.82772519999997.
[I 2024-12-11 05:53:42,518] Trial 5 pruned. 
[I 2024-12-11 06:00:15,344] Trial 6 finished with value: -205.85734779999999 and parameters: {'gamma': 0.98, 'learning_rate': 0.00034207328183841055, 'batch_size': 128, 'buffer_size': 10000, 'learning_starts': 10000, 'train_freq': 4, 'tau': 0.005, 'log_std_init': -3.966512481538212, 'net_arch': 'big'}. Best is trial 2 with value: -199.82772519999997.
[I 2024-12-11 06:41:47,942] Trial 7 finished with value: -720.3216856 and parameters: {'gamma': 0.98, 'learning_rate': 2.022323410151494e-05, 'batch_size': 1024, 'buffer_size': 10000, 'learning_starts': 0, 'train_freq': 256, 'tau': 0.08, 'log_std_init': -0.5731201508336161, 'net_arch': 'big'}. Best is trial 2 with value: -199.82772519999997.
[I 2024-12-11 06:43:13,043] Trial 8 finished with value: -209.3814972 and parameters: {'gamma': 0.98, 'learning_rate': 0.0008669778527549367, 'batch_size': 64, 'buffer_size': 1000000, 'learning_starts': 20000, 'train_freq': 1, 'tau': 0.01, 'log_std_init': -0.886519615755875, 'net_arch': 'medium'}. Best is trial 2 with value: -199.82772519999997.
[I 2024-12-11 06:52:08,608] Trial 9 finished with value: -210.09726719999998 and parameters: {'gamma': 0.98, 'learning_rate': 0.02156290451514205, 'batch_size': 32, 'buffer_size': 1000000, 'learning_starts': 0, 'train_freq': 32, 'tau': 0.08, 'log_std_init': -2.878660847548701, 'net_arch': 'big'}. Best is trial 2 with value: -199.82772519999997.
[I 2024-12-11 07:09:00,256] Trial 10 finished with value: -196.5264368 and parameters: {'gamma': 0.98, 'learning_rate': 0.00245040478330128, 'batch_size': 256, 'buffer_size': 100000, 'learning_starts': 1000, 'train_freq': 512, 'tau': 0.05, 'log_std_init': -2.2703035570646186, 'net_arch': 'big'}. Best is trial 10 with value: -196.5264368.
[I 2024-12-11 07:15:52,377] Trial 11 finished with value: -211.74791019999998 and parameters: {'gamma': 0.98, 'learning_rate': 0.000530363229794137, 'batch_size': 16, 'buffer_size': 100000, 'learning_starts': 1000, 'train_freq': 512, 'tau': 0.05, 'log_std_init': -1.3107247925407495, 'net_arch': 'big'}. Best is trial 10 with value: -196.5264368.
[I 2024-12-11 07:16:04,841] Trial 12 pruned. 
[I 2024-12-11 07:27:08,745] Trial 13 finished with value: -198.7213348 and parameters: {'gamma': 0.98, 'learning_rate': 0.021099630823807343, 'batch_size': 256, 'buffer_size': 100000, 'learning_starts': 1000, 'train_freq': 512, 'tau': 0.05, 'log_std_init': -1.9943638606588747, 'net_arch': 'medium'}. Best is trial 10 with value: -196.5264368.
[I 2024-12-11 07:38:24,541] Trial 14 finished with value: -205.8586244 and parameters: {'gamma': 0.98, 'learning_rate': 0.040262411210383084, 'batch_size': 256, 'buffer_size': 100000, 'learning_starts': 0, 'train_freq': 512, 'tau': 0.005, 'log_std_init': -2.4533649979474683, 'net_arch': 'medium'}. Best is trial 10 with value: -196.5264368.
[I 2024-12-11 07:47:52,489] Trial 15 pruned. 
[I 2024-12-11 08:03:23,755] Trial 16 pruned. 
[I 2024-12-11 08:14:14,871] Trial 17 pruned. 
========== Pendulum-v1 ==========
Seed: 1082581027
Loading hyperparameters from: /root/github/advanced_ml/Exercise2/rl-baselines3-zoo/hyperparams/sac.yml
Default hyperparameters for environment (ones being tuned will be overridden):
OrderedDict([('learning_rate', 0.001),
             ('n_timesteps', 20000),
             ('policy', 'MlpPolicy')])
Using 1 environments
Overwriting n_timesteps with n=25000
Doing 1 intermediate evaluations for pruning based on the number of timesteps. (1 evaluation every 100k timesteps)
Optimizing hyperparameters
Sampler: tpe - Pruner: median
Expected parameter loc (Tensor of shape (128, 1)) of distribution Normal(loc: torch.Size([128, 1]), scale: torch.Size([128, 1])) to satisfy the constraint Real(), but found invalid values:
tensor([[nan],
        [nan],
        [nan],
        [nan],
        [nan],
        [nan],
        [nan],
        [nan],
        [nan],
        [nan],
        [nan],
        [nan],
        [nan],
        [nan],
        [nan],
        [nan],
        [nan],
        [nan],
        [nan],
        [nan],
        [nan],
        [nan],
        [nan],
        [nan],
        [nan],
        [nan],
        [nan],
        [nan],
        [nan],
        [nan],
        [nan],
        [nan],
        [nan],
        [nan],
        [nan],
        [nan],
        [nan],
        [nan],
        [nan],
        [nan],
        [nan],
        [nan],
        [nan],
        [nan],
        [nan],
        [nan],
        [nan],
        [nan],
        [nan],
        [nan],
        [nan],
        [nan],
        [nan],
        [nan],
        [nan],
        [nan],
        [nan],
        [nan],
        [nan],
        [nan],
        [nan],
        [nan],
        [nan],
        [nan],
        [nan],
        [nan],
        [nan],
        [nan],
        [nan],
        [nan],
        [nan],
        [nan],
        [nan],
        [nan],
        [nan],
        [nan],
        [nan],
        [nan],
        [nan],
        [nan],
        [nan],
        [nan],
        [nan],
        [nan],
        [nan],
        [nan],
        [nan],
        [nan],
        [nan],
        [nan],
        [nan],
        [nan],
        [nan],
        [nan],
        [nan],
        [nan],
        [nan],
        [nan],
        [nan],
        [nan],
        [nan],
        [nan],
        [nan],
        [nan],
        [nan],
        [nan],
        [nan],
        [nan],
        [nan],
        [nan],
        [nan],
        [nan],
        [nan],
        [nan],
        [nan],
        [nan],
        [nan],
        [nan],
        [nan],
        [nan],
        [nan],
        [nan],
        [nan],
        [nan],
        [nan],
        [nan],
        [nan],
        [nan]], grad_fn=<AddmmBackward0>)
============
Sampled hyperparams:
{'batch_size': 128,
 'buffer_size': 1000000,
 'ent_coef': 'auto',
 'gamma': 0.98,
 'gradient_steps': 4,
 'learning_rate': 0.741770314574336,
 'learning_starts': 1000,
 'policy_kwargs': {'log_std_init': -1.2212771495789023,
                   'net_arch': [256, 256],
                   'use_sde': False},
 'target_entropy': 'auto',
 'tau': 0.08,
 'train_freq': 4}
Expected parameter loc (Tensor of shape (128, 1)) of distribution Normal(loc: torch.Size([128, 1]), scale: torch.Size([128, 1])) to satisfy the constraint Real(), but found invalid values:
tensor([[nan],
        [nan],
        [nan],
        [nan],
        [nan],
        [nan],
        [nan],
        [nan],
        [nan],
        [nan],
        [nan],
        [nan],
        [nan],
        [nan],
        [nan],
        [nan],
        [nan],
        [nan],
        [nan],
        [nan],
        [nan],
        [nan],
        [nan],
        [nan],
        [nan],
        [nan],
        [nan],
        [nan],
        [nan],
        [nan],
        [nan],
        [nan],
        [nan],
        [nan],
        [nan],
        [nan],
        [nan],
        [nan],
        [nan],
        [nan],
        [nan],
        [nan],
        [nan],
        [nan],
        [nan],
        [nan],
        [nan],
        [nan],
        [nan],
        [nan],
        [nan],
        [nan],
        [nan],
        [nan],
        [nan],
        [nan],
        [nan],
        [nan],
        [nan],
        [nan],
        [nan],
        [nan],
        [nan],
        [nan],
        [nan],
        [nan],
        [nan],
        [nan],
        [nan],
        [nan],
        [nan],
        [nan],
        [nan],
        [nan],
        [nan],
        [nan],
        [nan],
        [nan],
        [nan],
        [nan],
        [nan],
        [nan],
        [nan],
        [nan],
        [nan],
        [nan],
        [nan],
        [nan],
        [nan],
        [nan],
        [nan],
        [nan],
        [nan],
        [nan],
        [nan],
        [nan],
        [nan],
        [nan],
        [nan],
        [nan],
        [nan],
        [nan],
        [nan],
        [nan],
        [nan],
        [nan],
        [nan],
        [nan],
        [nan],
        [nan],
        [nan],
        [nan],
        [nan],
        [nan],
        [nan],
        [nan],
        [nan],
        [nan],
        [nan],
        [nan],
        [nan],
        [nan],
        [nan],
        [nan],
        [nan],
        [nan],
        [nan],
        [nan]], grad_fn=<AddmmBackward0>)
============
Sampled hyperparams:
{'batch_size': 128,
 'buffer_size': 10000,
 'ent_coef': 'auto',
 'gamma': 0.98,
 'gradient_steps': 256,
 'learning_rate': 0.3037748322834375,
 'learning_starts': 0,
 'policy_kwargs': {'log_std_init': -0.15774530542622722,
                   'net_arch': [64, 64],
                   'use_sde': False},
 'target_entropy': 'auto',
 'tau': 0.01,
 'train_freq': 256}
Expected parameter loc (Tensor of shape (64, 1)) of distribution Normal(loc: torch.Size([64, 1]), scale: torch.Size([64, 1])) to satisfy the constraint Real(), but found invalid values:
tensor([[nan],
        [nan],
        [nan],
        [nan],
        [nan],
        [nan],
        [nan],
        [nan],
        [nan],
        [nan],
        [nan],
        [nan],
        [nan],
        [nan],
        [nan],
        [nan],
        [nan],
        [nan],
        [nan],
        [nan],
        [nan],
        [nan],
        [nan],
        [nan],
        [nan],
        [nan],
        [nan],
        [nan],
        [nan],
        [nan],
        [nan],
        [nan],
        [nan],
        [nan],
        [nan],
        [nan],
        [nan],
        [nan],
        [nan],
        [nan],
        [nan],
        [nan],
        [nan],
        [nan],
        [nan],
        [nan],
        [nan],
        [nan],
        [nan],
        [nan],
        [nan],
        [nan],
        [nan],
        [nan],
        [nan],
        [nan],
        [nan],
        [nan],
        [nan],
        [nan],
        [nan],
        [nan],
        [nan],
        [nan]], grad_fn=<AddmmBackward0>)
============
Sampled hyperparams:
{'batch_size': 64,
 'buffer_size': 100000,
 'ent_coef': 'auto',
 'gamma': 0.98,
 'gradient_steps': 64,
 'learning_rate': 0.16211876309466444,
 'learning_starts': 20000,
 'policy_kwargs': {'log_std_init': -2.0083003243791184,
                   'net_arch': [400, 300],
                   'use_sde': False},
 'target_entropy': 'auto',
 'tau': 0.05,
 'train_freq': 64}
Expected parameter loc (Tensor of shape (2048, 1)) of distribution Normal(loc: torch.Size([2048, 1]), scale: torch.Size([2048, 1])) to satisfy the constraint Real(), but found invalid values:
tensor([[nan],
        [nan],
        [nan],
        ...,
        [nan],
        [nan],
        [nan]], grad_fn=<AddmmBackward0>)
============
Sampled hyperparams:
{'batch_size': 2048,
 'buffer_size': 100000,
 'ent_coef': 'auto',
 'gamma': 0.98,
 'gradient_steps': 32,
 'learning_rate': 0.9170722079823478,
 'learning_starts': 1000,
 'policy_kwargs': {'log_std_init': 0.02994998005607008,
                   'net_arch': [400, 300],
                   'use_sde': False},
 'target_entropy': 'auto',
 'tau': 0.05,
 'train_freq': 32}
[I 2024-12-11 08:14:18,350] Trial 18 pruned. 
[I 2024-12-11 08:29:52,836] Trial 19 finished with value: -203.5168974 and parameters: {'gamma': 0.98, 'learning_rate': 0.002166394667276442, 'batch_size': 512, 'buffer_size': 10000, 'learning_starts': 1000, 'train_freq': 512, 'tau': 0.05, 'log_std_init': -1.7234721774385298, 'net_arch': 'medium'}. Best is trial 10 with value: -196.5264368.
[I 2024-12-11 08:40:16,633] Trial 20 finished with value: -201.8468512 and parameters: {'gamma': 0.98, 'learning_rate': 0.0033579207398636702, 'batch_size': 256, 'buffer_size': 10000, 'learning_starts': 10000, 'train_freq': 8, 'tau': 0.05, 'log_std_init': -1.7886427157040488, 'net_arch': 'big'}. Best is trial 10 with value: -196.5264368.
[I 2024-12-11 08:57:06,277] Trial 21 pruned. 
[I 2024-12-11 08:57:59,726] Trial 22 finished with value: -200.4486168 and parameters: {'gamma': 0.98, 'learning_rate': 0.004818883155383444, 'batch_size': 256, 'buffer_size': 100000, 'learning_starts': 20000, 'train_freq': 512, 'tau': 0.05, 'log_std_init': -1.3095314538652707, 'net_arch': 'small'}. Best is trial 10 with value: -196.5264368.
[I 2024-12-11 09:07:14,129] Trial 23 pruned. 
[I 2024-12-11 09:58:15,661] Trial 24 finished with value: -195.84527039999998 and parameters: {'gamma': 0.98, 'learning_rate': 0.0014629696659627502, 'batch_size': 2048, 'buffer_size': 100000, 'learning_starts': 10000, 'train_freq': 512, 'tau': 0.005, 'log_std_init': -0.28483891899414027, 'net_arch': 'big'}. Best is trial 24 with value: -195.84527039999998.
[I 2024-12-11 11:18:56,954] Trial 25 finished with value: -197.2806214 and parameters: {'gamma': 0.98, 'learning_rate': 0.0006242106977212753, 'batch_size': 2048, 'buffer_size': 100000, 'learning_starts': 1000, 'train_freq': 256, 'tau': 0.005, 'log_std_init': 0.32600274256781714, 'net_arch': 'big'}. Best is trial 24 with value: -195.84527039999998.
[I 2024-12-11 12:21:49,000] Trial 26 finished with value: -197.94267399999998 and parameters: {'gamma': 0.98, 'learning_rate': 0.0015745433411354479, 'batch_size': 2048, 'buffer_size': 100000, 'learning_starts': 10000, 'train_freq': 1, 'tau': 0.005, 'log_std_init': -0.6758176753474491, 'net_arch': 'big'}. Best is trial 24 with value: -195.84527039999998.
[I 2024-12-11 12:33:25,529] Trial 27 pruned. 
[I 2024-12-11 12:49:41,971] Trial 28 finished with value: -203.39220720000003 and parameters: {'gamma': 0.98, 'learning_rate': 0.00016400248184833053, 'batch_size': 256, 'buffer_size': 100000, 'learning_starts': 1000, 'train_freq': 32, 'tau': 0.005, 'log_std_init': 0.4767852592711067, 'net_arch': 'big'}. Best is trial 24 with value: -195.84527039999998.
[I 2024-12-11 12:53:55,213] Trial 29 pruned. 
[I 2024-12-11 13:09:45,626] Trial 30 pruned. 
[I 2024-12-11 13:59:06,256] Trial 31 pruned. 
[I 2024-12-11 14:03:38,853] Trial 32 finished with value: -200.1009688 and parameters: {'gamma': 0.98, 'learning_rate': 0.0021930599073765795, 'batch_size': 16, 'buffer_size': 100000, 'learning_starts': 10000, 'train_freq': 128, 'tau': 0.005, 'log_std_init': -0.7587385587947528, 'net_arch': 'big'}. Best is trial 24 with value: -195.84527039999998.
[I 2024-12-11 15:03:05,186] Trial 33 finished with value: -197.4871368 and parameters: {'gamma': 0.98, 'learning_rate': 0.0005815018949165667, 'batch_size': 2048, 'buffer_size': 100000, 'learning_starts': 10000, 'train_freq': 512, 'tau': 0.08, 'log_std_init': -1.1530923299080311, 'net_arch': 'big'}. Best is trial 24 with value: -195.84527039999998.
[I 2024-12-11 15:11:59,078] Trial 34 finished with value: -199.7138726 and parameters: {'gamma': 0.98, 'learning_rate': 0.0012819973055063069, 'batch_size': 2048, 'buffer_size': 100000, 'learning_starts': 1000, 'train_freq': 256, 'tau': 0.01, 'log_std_init': -0.3098210791495445, 'net_arch': 'small'}. Best is trial 24 with value: -195.84527039999998.
[I 2024-12-11 15:17:52,895] Trial 35 pruned. 
[I 2024-12-11 15:26:39,647] Trial 36 pruned. 
[I 2024-12-11 16:15:27,663] Trial 37 finished with value: -197.94846959999998 and parameters: {'gamma': 0.98, 'learning_rate': 0.00015829079855318447, 'batch_size': 2048, 'buffer_size': 100000, 'learning_starts': 10000, 'train_freq': 8, 'tau': 0.08, 'log_std_init': -1.380434997956153, 'net_arch': 'big'}. Best is trial 24 with value: -195.84527039999998.
[I 2024-12-11 16:20:27,282] Trial 38 pruned. 
[I 2024-12-11 16:24:07,486] Trial 39 pruned. 
[I 2024-12-11 16:27:27,305] Trial 40 pruned. 
[I 2024-12-11 17:48:41,661] Trial 41 finished with value: -194.78790120000002 and parameters: {'gamma': 0.98, 'learning_rate': 0.0076741155152266665, 'batch_size': 2048, 'buffer_size': 100000, 'learning_starts': 1000, 'train_freq': 256, 'tau': 0.005, 'log_std_init': 0.20204202497002022, 'net_arch': 'big'}. Best is trial 41 with value: -194.78790120000002.
[I 2024-12-11 19:08:24,073] Trial 42 finished with value: -196.49839060000002 and parameters: {'gamma': 0.98, 'learning_rate': 0.00257696286804088, 'batch_size': 2048, 'buffer_size': 100000, 'learning_starts': 1000, 'train_freq': 16, 'tau': 0.08, 'log_std_init': 0.48616088087927234, 'net_arch': 'big'}. Best is trial 41 with value: -194.78790120000002.
[I 2024-12-11 20:28:55,440] Trial 43 finished with value: -197.320829 and parameters: {'gamma': 0.98, 'learning_rate': 0.0009894288746497028, 'batch_size': 2048, 'buffer_size': 100000, 'learning_starts': 1000, 'train_freq': 64, 'tau': 0.005, 'log_std_init': 0.8910366395854589, 'net_arch': 'big'}. Best is trial 41 with value: -194.78790120000002.
[I 2024-12-11 20:37:43,121] Trial 44 pruned. 
[I 2024-12-11 22:02:02,801] Trial 45 finished with value: -199.02825360000003 and parameters: {'gamma': 0.98, 'learning_rate': 0.002159510587670641, 'batch_size': 2048, 'buffer_size': 100000, 'learning_starts': 0, 'train_freq': 16, 'tau': 0.02, 'log_std_init': -0.19628045168786767, 'net_arch': 'big'}. Best is trial 41 with value: -194.78790120000002.
[I 2024-12-11 23:23:42,589] Trial 46 finished with value: -195.7877546 and parameters: {'gamma': 0.98, 'learning_rate': 0.016119874897091855, 'batch_size': 2048, 'buffer_size': 100000, 'learning_starts': 1000, 'train_freq': 256, 'tau': 0.08, 'log_std_init': 0.266530169236617, 'net_arch': 'big'}. Best is trial 41 with value: -194.78790120000002.
[I 2024-12-11 23:32:04,053] Trial 47 pruned. 
[I 2024-12-11 23:47:21,627] Trial 48 pruned. 
